{
  "test_id": "PRESS-001-2025-10-30",
  "line_id": "LH2-DIST-001",
  "test_date": "2025-10-30",
  "test_type": "Helium Leak",
  "line_specification": {
    "material": "316L Stainless Steel",
    "nominal_diameter_inches": 1.0,
    "wall_thickness_mm": 2.0,
    "design_pressure_bar": 12.0,
    "design_temperature_k": 20.0,
    "length_meters": 15.5,
    "vacuum_jacket": true
  },
  "test_parameters": {
    "test_pressure_bar": 18.0,
    "hold_time_minutes": 10,
    "test_medium": "Helium",
    "test_temperature_c": 22,
    "ambient_temperature_c": 22,
    "ambient_pressure_mbar": 1013
  },
  "helium_leak_test": {
    "tracer_gas": "Helium 100%",
    "detector_type": "Mass Spectrometer",
    "detector_serial": "MS-12345",
    "detector_calibration_date": "2025-09-15",
    "background_leak_rate_mbar_l_s": 1.0e-9,
    "acceptance_criteria_mbar_l_s": 1.0e-6
  },
  "results": {
    "test_outcome": "Pass",
    "pressure_drop_bar": 0.1,
    "leak_rate_mbar_l_s": 3.5e-7,
    "leak_locations": [],
    "visible_defects": [],
    "deformation_observed": false,
    "pressure_maintained": true
  },
  "disposition": "Accepted",
  "corrective_actions": [],
  "retest": {
    "required": false
  },
  "personnel": {
    "technician": {
      "name": "John Smith",
      "certification": "PRESS-TEST-2024",
      "signature_hash": "sha256:abc123..."
    },
    "inspector": {
      "name": "Jane Doe",
      "certification": "AS9100-QI-2024",
      "signature_hash": "sha256:def456..."
    }
  },
  "equipment_used": [
    {
      "equipment_type": "Helium Leak Detector",
      "manufacturer": "Pfeiffer",
      "model": "ASM 340",
      "serial_number": "MS-12345",
      "calibration_date": "2025-09-15",
      "calibration_due": "2026-03-15"
    },
    {
      "equipment_type": "Pressure Gauge",
      "manufacturer": "Rosemount",
      "model": "3051",
      "serial_number": "PG-67890",
      "calibration_date": "2025-08-01",
      "calibration_due": "2026-02-01"
    }
  ],
  "documentation": {
    "test_procedure_id": "PROC_28-60-03",
    "work_order": "WO-2025-1234",
    "photos": [
      {
        "filename": "line_001_weld_inspection_01.jpg",
        "file_hash": "sha256:photo1hash...",
        "description": "Weld joint at station 123"
      }
    ],
    "data_logger_file": "leak_test_2025_10_30.csv",
    "report_file_hash": "sha256:report_hash..."
  },
  "approvals": [
    {
      "authority": "Quality Assurance",
      "name": "Jane Doe",
      "status": "Approved",
      "date": "2025-10-30",
      "signature_hash": "sha256:def456...",
      "comments": "Test performed per procedure. Results acceptable."
    },
    {
      "authority": "Cryogenic Systems Engineering",
      "name": "Dr. Elena Petrov",
      "status": "Approved",
      "date": "2025-10-30",
      "signature_hash": "sha256:eng789...",
      "comments": "Reviewed and approved for installation."
    }
  ]
}
